{
  "profileId": "spotcomp-info-game-example",
  "status": "candidate",
  "evidence": [
    "INFORMATION-GAMES.md",
    "CHUNK-MAP.md#information-to-games"
  ],
  "polarityRule": "game-theoretic-player-opponent",
  "globalFrontierAssumption": false,
  "informationObjects": [
    {
      "id": "info:alice-frontier",
      "receiver": "player:alice",
      "settlement": {
        "regime": "scott-continuous",
        "ruleSystem": "rules:local-settlement-alpha",
        "frontierKind": "finite-observed-prefix"
      },
      "settledFrontier": [
        "row:frontier-a",
        "row:frontier-b"
      ],
      "aboutness": [
        {
          "entity": "thing:task-17",
          "predicate": "predicate:assigned-to",
          "value": "t",
          "evidence": ["row:frontier-a"]
        }
      ],
      "recognitionFiber": "fiber:alice-recognition",
      "provenance": "trace:shared#frontier-a-b",
      "evidence": [
        "lab/hacking/library/being/doing/library/library/information/knowing-as-settling/knowing-as-settling.md",
        "lab/hacking/library/being/doing/library/library/information/aboutness/aboutness.md"
      ]
    },
    {
      "id": "info:bob-frontier",
      "receiver": "player:bob",
      "settlement": {
        "regime": "scott-continuous",
        "ruleSystem": "rules:local-settlement-beta",
        "frontierKind": "finite-observed-prefix"
      },
      "settledFrontier": [
        "row:frontier-a",
        "row:frontier-c"
      ],
      "aboutness": [
        {
          "entity": "thing:task-17",
          "predicate": "predicate:blocked-by",
          "value": "bot",
          "evidence": ["row:frontier-c"]
        }
      ],
      "recognitionFiber": "fiber:bob-recognition",
      "provenance": "trace:shared#frontier-a-c",
      "evidence": [
        "lab/hacking/library/being/doing/library/philosophy/semiotics/information/information.md"
      ]
    }
  ],
  "observationMaps": [
    {
      "id": "obs:alice-task-view",
      "playerId": "player:alice",
      "sourceInformation": "info:alice-frontier",
      "observableFrontier": [
        "row:frontier-a"
      ],
      "preservesAxes": [
        "events",
        "aboutness",
        "frontier",
        "provenance"
      ],
      "forgetsAxes": [
        "refinement"
      ],
      "evidence": ["INFORMATION-GAMES.md#observation-maps"]
    },
    {
      "id": "obs:bob-task-view",
      "playerId": "player:bob",
      "sourceInformation": "info:bob-frontier",
      "observableFrontier": [
        "row:frontier-c"
      ],
      "preservesAxes": [
        "events",
        "aboutness",
        "frontier"
      ],
      "forgetsAxes": [
        "refinement",
        "evidence-trajectory"
      ],
      "evidence": ["INFORMATION-GAMES.md#observation-maps"]
    }
  ],
  "arenaBinding": {
    "cgsProfile": "examples/cgs-profile.json",
    "observeEvents": [
      {
        "observationMap": "obs:alice-task-view",
        "event": "event:alice-observe",
        "evidence": ["CGS-EMBEDDING.md#event-kinds"]
      },
      {
        "observationMap": "obs:bob-task-view",
        "event": "event:bob-observe",
        "evidence": ["CGS-EMBEDDING.md#event-kinds"]
      }
    ],
    "settlementEvents": [
      {
        "informationObject": "info:alice-frontier",
        "event": "event:alice-settle",
        "evidence": ["CGS-EMBEDDING.md#causality"]
      }
    ]
  },
  "strategyBindings": [
    {
      "playerId": "player:alice",
      "observationMap": "obs:alice-task-view",
      "strategyId": "strategy:alice-local",
      "actionEvents": [
        "event:alice-act"
      ],
      "evidence": ["INFORMATION-GAMES.md#strategy-binding"]
    },
    {
      "playerId": "player:bob",
      "observationMap": "obs:bob-task-view",
      "strategyId": "strategy:bob-local",
      "actionEvents": [
        "event:bob-act"
      ],
      "evidence": ["INFORMATION-GAMES.md#strategy-binding"]
    }
  ],
  "federationComposition": {
    "mode": "parallel-composition",
    "sharedEvidence": [
      "row:frontier-a"
    ],
    "symmetry": "symmetry:finite-support-player-renaming",
    "evidence": [
      "development/active/articulating/library/articulation-cell/library/potential-articulation-cell/predicating/library/predication-category/library/predication-cell-set/library/predicate-set/library/predicate-category/hacking/library/thing/library/system/hacking/library/game-system/hacking/library/concurrent-game-system/docs/dev/journal/2026-05-24.md"
    ]
  },
  "openObligations": [
    "prove full information-to-CGS functor",
    "bind actionEvents to checked cgs-profile event ids"
  ]
}
